exam_category,exam_type,quiz_id,en_quiz_title,most_vote,correct,en_A,en_B,en_C,en_D,en_E,en_F,en_G,ko_quiz_title,ko_A,ko_B,ko_C,ko_D,ko_E,ko_G,subject,choice_count,ko_F
udemy,DVA-02,228,A newly hired developer has been instructed to debug an application. She tried to access the X-Ray console to view service maps and segments but her current access is insufficient. Which of the following is the MOST appropriate managed policy that should be granted to the developer?,C,C,AWSXRayDaemonWriteAccess,AWSXrayFullAccess,AWSXrayReadOnlyAccess,AmazonS3ReadOnlyAccess,,,,새로 고용된 개발자는 애플리케이션을 디버깅하라는 지시를 받았습니다. 그녀는 서비스 맵과 구간을 보기 위해 X-Ray 콘솔에 액세스하려고 시도했지만 현재 액세스 권한이 충분하지 않습니다.다음 중 개발자에게 부여해야 하는 가장 적절한 관리형 정책은 무엇입니까?,AWSXRayDaemonWriteAccess,AWSXrayFullAccess,AWSXrayReadOnlyAccess,AmazonS3ReadOnlyAccess,,,0,,
udemy,DVA-02,229,A mobile game has a DynamoDB table named TutorialsDojoScores which keeps track of the users and their respective scores. Each item in the table is identified by the FighterId attribute as its partition key and the FightTitle attribute as the sort key. A developer needs to retrieve data from non-key attributes of the table named DojoTopScores and DojoDateTime attributes. Which type of index should the developer add in the table to speed up queries on non-key attributes?,D,D,Sparse Index,Local Secondary Index,Primary Index,Global Secondary Index,,,,모바일 게임에는 TutorialsDojoScores사용자와 해당 점수를 추적하는 DynamoDB 테이블이 있습니다. 테이블의 각 항목은 FighterId파티션 키인 속성과 FightTitle정렬 키인 속성으로 식별됩니다. 개발자는 이름이 지정된 테이블의 키가 아닌 속성 DojoTopScores과 DojoDateTime속성에서 데이터를 검색해야 합니다.키가 아닌 속성에 대한 쿼리 속도를 높이려면 개발자가 테이블에 어떤 유형의 인덱스를 추가해야 합니까?,희소 인덱스,로컬 보조 인덱스,기본 인덱스,글로벌 보조 지수,,,0,,
udemy,DVA-02,230,"An application is hosted in an On-Demand Linux EC2 instance which uses an RDS database. There have been a lot of complaints that the application often crashes, but the support team can't pinpoint the problem using CloudWatch. To properly troubleshoot the issue, the team wants to monitor the memory and swap usage of the instance and the number of idle and running processes as well.Which of the following is the MOST suitable solution to use in this scenario?",D,D,Install the AWS X-Ray daemon on the EC2 instance.,Use AWS Cloud9 to consolidate all metrics in a single dashboard.,Use detailed monitoring in CloudWatch.,Install the Amazon CloudWatch Logs agent to the EC2 instance.,,,,애플리케이션은 RDS 데이터베이스를 사용하는 온디맨드 Linux EC2 인스턴스에서 호스팅됩니다. 애플리케이션이 자주 충돌한다는 불만이 많았지만 지원팀에서는 CloudWatch를 사용하여 문제를 정확히 찾아낼 수 없습니다. 문제를 적절하게 해결하기 위해 팀에서는 인스턴스의 메모리 및 스왑 사용량과 유휴 및 실행 중인 프로세스 수를 모니터링하려고 합니다.다음 중 이 시나리오에 사용하기에 가장 적합한 솔루션은 무엇입니까?,EC2 인스턴스에 AWS X-Ray 데몬을 설치합니다.,AWS Cloud9을 사용하여 모든 지표를 단일 대시보드에 통합하세요.,CloudWatch에서 세부 모니터링을 사용하세요.,Amazon CloudWatch Logs 에이전트를 EC2 인스턴스에 설치합니다.,,,0,,
udemy,DVA-02,231,"A developer has been instructed to configure Cross-Region Replication (CRR) to their S3 bucket as part of the company's disaster recovery plan. She is using the put-bucket-replication AWS CLI to enable CRR on the bucket but it fails whenever she attempts to issue the command. However, the same command works for the other S3 buckets. Which of the following options is the MOST likely reason for this issue?",C,C,Amazon S3 Object Lock is enabled in the bucket.,The bucket should be configured as a static web hosting first.,Versioning is not enabled in the bucket.,S3 Transfer Acceleration is not enabled in the bucket.,,,,개발자는 회사 재해 복구 계획의 일부로 S3 버킷에 CRR(교차 지역 복제)을 구성하라는 지시를 받았습니다. 그녀는 put-bucket-replicationAWS CLI를 사용하여 버킷에서 CRR을 활성화하지만 명령을 실행하려고 할 때마다 실패합니다. 그러나 다른 S3 버킷에도 동일한 명령이 작동합니다.다음 옵션 중 이 문제의 가장 큰 원인은 무엇입니까?,버킷에서 Amazon S3 객체 잠금이 활성화되었습니다.,먼저 버킷을 정적 웹 호스팅으로 구성해야 합니다.,버킷에서 버전 관리가 활성화되어 있지 않습니다.,버킷에서 S3 Transfer Acceleration이 활성화되어 있지 않습니다.,,,0,,
udemy,DVA-02,232,"A cryptocurrency exchange portal has a key management service hosted in their on-premises data center, which stores encryption keys and uses an RSA asymmetric encryption algorithm. The company has recently implemented a hybrid cloud architecture in AWS and you were assigned to migrate the exchange portal to their cloud infrastructure. For security compliance, the keys should be stored in dedicated, third-party validated hardware security modules under your exclusive control. Which of the following is the BEST solution that you should implement to meet the above requirement?",D,D,Use AWS KMS to store and manage the encryption keys.,Import the encryption keys from your on-premises key management service to AWS Secrets Manager as Customer Master Keys (CMKs).,Develop a custom key management service using the AWS Encryption SDK.,Import the encryption keys from your on-premises key management service to AWS CloudHSM.,,,,암호화폐 거래소 포털에는 암호화 키를 저장하고 RSA 비대칭 암호화 알고리즘을 사용하는 온프레미스 데이터 센터에 호스팅되는 키 관리 서비스가 있습니다. 회사는 최근 AWS에 하이브리드 클라우드 아키텍처를 구현했으며 귀하는 Exchange 포털을 클라우드 인프라로 마이그레이션하도록 배정되었습니다. 보안 규정 준수를 위해 키는 귀하가 독점적으로 관리하는 타사의 검증된 전용 하드웨어 보안 모듈에 저장되어야 합니다.다음 중 위의 요구 사항을 충족하기 위해 구현해야 하는 가장 좋은 솔루션은 무엇입니까?,AWS KMS를 사용하여 암호화 키를 저장하고 관리합니다.,온프레미스 키 관리 서비스의 암호화 키를 고객 마스터 키(CMK)로 AWS Secrets Manager로 가져옵니다.,AWS 암호화 SDK를 사용하여 사용자 지정 키 관리 서비스를 개발합니다.,온프레미스 키 관리 서비스에서 AWS CloudHSM으로 암호화 키를 가져옵니다.,,,0,,
udemy,DVA-02,233,"A developer is currently building a scalable microservices architecture where complex applications are decomposed into smaller, independent services. Docker will be used as its application container to provide an optimal way of running small, decoupled services. The developer should also have fine-grained control over the custom application architecture. Which of the following services is the MOST suitable one to use?",D,D,Elastic Beanstalk,AWS SAM,EC2,ECS,,,,개발자는 현재 복잡한 애플리케이션을 더 작고 독립적인 서비스로 분해하는 확장 가능한 마이크로서비스 아키텍처를 구축하고 있습니다. Docker는 소규모의 분리된 서비스를 실행하는 최적의 방법을 제공하기 위해 애플리케이션 컨테이너로 사용됩니다. 또한 개발자는 사용자 정의 애플리케이션 아키텍처를 세밀하게 제어할 수 있어야 합니다.다음 중 사용하기에 가장 적합한 서비스는 무엇입니까?,엘라스틱 콩나무,AWS SAM,EC2,ECS,,,0,,
udemy,DVA-02,234,A developer will be building a game data feed application which will continuously collect data about player-game interactions and feed the data into your gaming platform. The application uses the Kinesis Client Library to process the data stream from the Amazon Kinesis Data Streams and stores the data to Amazon DynamoDB. It is required that the system should have enough shards and EC2 instances in order to handle failover and adequately process the amount of data coming in and out of the stream. Which of the following ratio of the number of Kinesis shards to EC2 worker instances should the developer implement to achieve the above requirement in the most cost-effective and highly available way?,A,A,4 shards : 2 instances,6 shards : 1 instance,1 shard : 6 instances,4 shards : 8 instances,,,,개발자는 플레이어-게임 상호 작용에 대한 데이터를 지속적으로 수집하고 게임 플랫폼에 데이터를 공급하는 게임 데이터 피드 애플리케이션을 구축할 것입니다. 애플리케이션은 Kinesis Client Library를 사용하여 Amazon Kinesis Data Streams의 데이터 스트림을 처리하고 해당 데이터를 Amazon DynamoDB에 저장합니다. 장애 조치를 처리하고 스트림에 들어오고 나가는 데이터 양을 적절하게 처리하려면 시스템에 충분한 샤드와 EC2 인스턴스가 있어야 합니다.개발자가 가장 비용 효율적이고 가용성이 높은 방식으로 위의 요구 사항을 달성하기 위해 다음 중 EC2 작업자 인스턴스에 대한 Kinesis 샤드 수의 비율을 구현해야 합니까?,샤드 4개: 인스턴스 2개,샤드 6개: 인스턴스 1개,샤드 1개 : 인스턴스 6개,샤드 4개: 인스턴스 8개,,,0,,
udemy,DVA-02,235,"A company is using OpenAPI, which is also known as Swagger, for the API specifications of their REST web services that are hosted on their on-premises data center. They want to migrate their system to AWS using Lambda and API Gateway. In line with this, you are instructed to create a new API and populate it with the resources and methods from their Swagger definition. Which of the following is the EASIEST way to accomplish this task?",A,A,Import their Swagger or OpenAPI definitions to API Gateway using the AWS Console.,Use AWS SAM to migrate and deploy the company's web services to API Gateway.,Create models and templates for request and response mappings based on the company's API definitions.,Use CodeDeploy to migrate and deploy the company's web services to API Gateway.,,,,한 회사는 온프레미스 데이터 센터에서 호스팅되는 REST 웹 서비스의 API 사양에 대해 Swagger라고도 알려진 OpenAPI를 사용하고 있습니다. 그들은 Lambda와 API Gateway를 사용하여 시스템을 AWS로 마이그레이션하려고 합니다. 이에 따라 새 API를 생성하고 Swagger 정의의 리소스 및 메서드로 채우라는 지시를 받습니다.다음 중 이 작업을 수행하는 가장 쉬운 방법은 무엇입니까?,AWS 콘솔을 사용하여 Swagger 또는 OpenAPI 정의를 API 게이트웨이로 가져옵니다.,AWS SAM을 사용하여 회사의 웹 서비스를 API 게이트웨이로 마이그레이션하고 배포합니다.,회사의 API 정의를 기반으로 요청 및 응답 매핑을 위한 모델과 템플릿을 만듭니다.,CodeDeploy를 사용하여 회사의 웹 서비스를 API Gateway로 마이그레이션하고 배포합니다.,,,0,,
udemy,DVA-02,236,A developer is building an online game in AWS which will be using a NoSQL database with DynamoDB. Each player data has an average size of 3.5 KB and it is expected that the game will send 150 eventually consistent read requests per second. How may Read Capacity Units (RCU) should the developer provision to the table?,C,C,600,150,75,300,,,,개발자는 DynamoDB와 함께 NoSQL 데이터베이스를 사용할 온라인 게임을 AWS에서 구축하고 있습니다. 각 플레이어 데이터의 평균 크기는 3.5KB이며 게임은 초당 150개의 일관된 읽기 요청을 보낼 것으로 예상됩니다.개발자는 RCU(읽기 용량 단위)를 테이블에 어떻게 프로비저닝해야 합니까?,600,150,75,300,,,0,,
udemy,DVA-02,237,"A company has an AWS account with an ID of 061218980612 and has a centralized Java web application hosted in AWS Elastic Beanstalk that is used by different departments. The developer used the iam create-account-alias --account-alias finance-dept AWS CLI command to create a user-friendly identifier for the finance department.For faster troubleshooting, the application must also be configured to easily trace all its downstream requests, such as Apache HTTP requests, AWS SDK requests, and SQL queries made using a JDBC driver. The ability to send traces to multiple different tracing backends without having to re-instrument the application code is required as well.Which of the following options is the MOST suitable solution that the developer implements?",B,B,Use the https://finance-dept.aws.amazon.com/console sign-in page URL for the AWS account. Install and configure the AWS X-Ray auto-instrumentation Java agent to trace all the downstream API calls.,Use the https://finance-dept.signin.aws.amazon.com/console sign-in page URL for the AWS account. Install the AWS Distro for OpenTelemetry Collector and set up the AWS Distro for OpenTelemetry to trace all the downstream API calls.,Use the https://finance-dept.aws.signin.amazon.com/console sign-in page URL for the AWS account. Set up and configure an IAM Roles Anywhere trust model in Elastic Beanstalk with a proper source identity prefix to trace all the downstream API calls.,Use the https://061218980612.aws.signin.amazon.com/console sign-in page URL for the AWS account. Set up and configure the Amazon CloudWatch Evidently to trace all the downstream API calls.,,,,"회사에는 ID가 061218980612인 AWS 계정이 있고 여러 부서에서 사용되는 AWS Elastic Beanstalk에서 호스팅되는 중앙 집중식 Java 웹 애플리케이션이 있습니다. 개발자는 iam create-account-alias --account-alias finance-deptAWS CLI 명령을 사용하여 재무 부서에 대한 사용자 친화적인 식별자를 생성했습니다.더 빠른 문제 해결을 위해서는 Apache HTTP 요청, AWS SDK 요청, JDBC 드라이버를 사용하여 생성된 SQL 쿼리 등 모든 다운스트림 요청을 쉽게 추적하도록 애플리케이션을 구성해야 합니다. 애플리케이션 코드를 다시 계측할 필요 없이 여러 다른 추적 백엔드로 추적을 보내는 기능도 필요합니다.다음 옵션 중 개발자가 구현하는 가장 적합한 솔루션은 무엇입니까?",https://finance-dept.aws.amazon.com/consoleAWS 계정의 로그인 페이지 URL을 사용합니다 . 모든 다운스트림 API 호출을 추적하도록 AWS X-Ray 자동 계측 Java 에이전트를 설치하고 구성합니다.,https://finance-dept.signin.aws.amazon.com/consoleAWS 계정의 로그인 페이지 URL을 사용합니다 . OpenTelemetry용 AWS Distro Collector를 설치하고 모든 다운스트림 API 호출을 추적하도록 OpenTelemetry용 AWS Distro를 설정합니다.,https://finance-dept.aws.signin.amazon.com/consoleAWS 계정의 로그인 페이지 URL을 사용합니다 . 모든 다운스트림 API 호출을 추적하기 위해 적절한 소스 ID 접두사를 사용하여 Elastic Beanstalk에서 IAM Roles Anywhere 신뢰 모델을 설정하고 구성합니다.,https://061218980612.aws.signin.amazon.com/consoleAWS 계정의 로그인 페이지 URL을 사용합니다 . 모든 다운스트림 API 호출을 추적하도록 Amazon CloudWatch를 설정하고 구성합니다.,,,0,,
udemy,DVA-02,238,"A developer has enabled API Caching on his application endpoints in Amazon API Gateway. For testing purposes, he wants to fetch the latest data, and not the cache data, whenever he sends a GET request with a Cache-Control: max-age=0 header to a specific resource. Which of the following policies will allow him to invalidate the cache for requests?",D,D,"{  ""Version"": ""2012-10-17"",  ""Statement"": [    {      ""Effect"": ""Allow"",      ""Action"": [        ""execute-api:Invoke""      ],      ""Resource"": [""arn:aws:execute-api:region:account-id:api-id/stage-name/GET/resource-path-specifier""      ]   } ]}","{ ""Version"": ""2012-10-17"", ""Statement"": [  {   ""Effect"": ""Deny"",   ""Action"": [    ""execute-api:*""   ],   ""Resource"": [    ""arn:aws:execute-api:region:account-id:api-id/stage-name/GET/resource-path-specifier""   ]  } ]}","{ ""Version"": ""2012-10-17"", ""Statement"": [  {   ""Effect"": ""Deny"",   ""Action"": [    ""execute-api:InvalidateCache""   ],   ""Resource"": [    ""arn:aws:execute-api:region:account-id:api-id/stage-name/GET/resource-path-specifier""   ]  } ]}","{ ""Version"": ""2012-10-17"", ""Statement"": [  {   ""Effect"": ""Allow"",   ""Action"": [    ""execute-api:InvalidateCache""   ],   ""Resource"": [    ""arn:aws:execute-api:region:account-id:api-id/stage-name/GET/resource-path-specifier""   ]  } ]}",,,,개발자가 Amazon API Gateway의 애플리케이션 엔드포인트에서 API 캐싱을 활성화했습니다. Cache-Control: max-age=0테스트 목적으로 그는 특정 리소스에 헤더가 포함된 GET 요청을 보낼 때마다 캐시 데이터가 아닌 최신 데이터를 가져오고 싶어합니다 .다음 중 요청에 대한 캐시를 무효화할 수 있는 정책은 무엇입니까?,"{  ""버전"" : ""2012- 10-17"" ,  ""진술"" : [     {      ""효과"" : ""허용"" ,       ""액션"" : [         ""실행하다-API:호출""      ],      ""리소스"" : [ ""arn:aws:실행-API:지역:계정 ID:API-아이디/스테이지-이름/GET/자원e-경로 지정자""      ]   } ]}","{ ""버전"" : ""2012-10-17"" ,  ""진술"" : [   {   ""효과"" : ""거부"" ,    ""액션"" : [     ""execute-api:*""   ],   ""리소스"" : [     ""arn:aws:execute-api:region:account-id:api-id/stage-name/GET/resource-path-specifier""   ]  } ]}","{ ""버전"" : ""2012-10-17"" ,  ""진술"" : [   {   ""효과"" : ""거부"" ,    ""액션"" : [     ""execute-api:InvalidateCache""   ],   ""리소스"" : [     ""arn:aws:execute-api:region:account-id:api-id/stage-name/GET/resource-path-specifier""   ]  } ]}","{ ""버전"" : ""2012-10-17"" ,  ""진술"" : [   {   ""효과"" : ""허용"" ,    ""액션"" : [     ""execute-api:InvalidateCache""   ],   ""리소스"" : [     ""arn:aws:execute-api:region:account-id:api-id/stage-name/GET/resource-path-specifier""   ]  } ]}",,,0,,
udemy,DVA-02,239,"Your development team is heavily relying on AWS managed solutions like CodeCommit, CodeBuild, CodePipeline, and CodeDeploy. As your project grows, you would like to further automate your CI/CD process. The management also requested to have a project dashboard to centrally monitor application activity and manage day-to-day development tasks.Which of the following AWS services will help you achieve this?",C,C,Amazon CodeGuru,AWS Elastic Beanstalk,AWS CodeStar,AWS Fault Injection Simulator,,,,"개발 팀은 CodeCommit, CodeBuild, CodePipeline 및 CodeDeploy와 같은 AWS 관리형 솔루션에 크게 의존하고 있습니다. 프로젝트가 성장함에 따라 CI/CD 프로세스를 더욱 자동화하고 싶습니다. 또한 경영진은 애플리케이션 활동을 중앙에서 모니터링하고 일상적인 개발 작업을 관리할 수 있는 프로젝트 대시보드를 요청했습니다.다음 중 어떤 AWS 서비스가 이를 달성하는 데 도움이 됩니까?",Amazon CodeGuru,AWS 엘라스틱 빈스토크,AWS 코드스타,AWS 오류 주입 시뮬레이터,,,0,,
udemy,DVA-02,240,"A startup has an urgent requirement to deploy their new NodeJS application to AWS. You were assigned to perform the deployment to a service where you don't need to worry about the underlying infrastructure that runs the application. The service must also automatically handle provisioning, load balancing, scaling, and application health monitoring. Which service will you use to easily deploy and manage the application?",A,A,AWS Elastic Beanstalk,AWS CloudFormation,AWS CodeDeploy,AWS SAM,,,,"스타트업에는 새로운 NodeJS 애플리케이션을 AWS에 배포해야 하는 긴급한 요구 사항이 있습니다. 귀하는 애플리케이션을 실행하는 기본 인프라에 대해 걱정할 필요가 없는 서비스에 대한 배포를 수행하도록 지정되었습니다. 또한 서비스는 프로비저닝, 로드 밸런싱, 크기 조정 및 애플리케이션 상태 모니터링을 자동으로 처리해야 합니다.애플리케이션을 쉽게 배포하고 관리하기 위해 어떤 서비스를 사용하시겠습니까?",AWS 엘라스틱 빈스토크,AWS 클라우드포메이션,AWS 코드배포,AWS SAM,,,0,,
udemy,DVA-02,241,"A company is developing a distributed system which will use a Lambda function that will be invoked asynchronously. In the event of failure, the function must be retried twice before sending the unprocessed events to an Amazon SQS queue through the use of Dead Letter Queue (DLQ). Which of the following is the correct way to implement a DLQ in Lambda?",B,B,Specify the AWS Service Namespace of the SQS Queue in the Lambda function's DeadLetterConfig parameter.,Specify the Amazon Resource Name of the SQS Queue in the Lambda function's DeadLetterConfig parameter.,Specify the Amazon Resource Name of the SQS Queue in the Transform section of the AWS SAM template that you'll use for deploying the function.,Specify the AWS Service Namespace of the SQS Queue in the AWS::Lambda::Function resource of the CloudFormation template that you'll use for deploying the function.,,,,한 회사는 비동기식으로 호출되는 Lambda 함수를 사용하는 분산 시스템을 개발하고 있습니다. 오류가 발생한 경우 DLQ(배달 못한 편지 대기열)를 사용하여 처리되지 않은 이벤트를 Amazon SQS 대기열로 보내기 전에 함수를 두 번 재시도해야 합니다.다음 중 Lambda에서 DLQ를 구현하는 올바른 방법은 무엇입니까?,Lambda 함수의 매개변수에 SQS 대기열의 AWS 서비스 네임스페이스를 지정합니다 DeadLetterConfig.,Lambda 함수의 매개변수에 SQS 대기열의 Amazon 리소스 이름을 지정합니다 DeadLetterConfig.,Transform함수 배포에 사용할 AWS SAM 템플릿 섹션 에서 SQS 대기열의 Amazon 리소스 이름을 지정합니다 .,AWS::Lambda::Function함수 배포에 사용할 CloudFormation 템플릿의 리소스 에 SQS 대기열의 AWS 서비스 네임스페이스를 지정합니다 .,,,0,,
udemy,DVA-02,242,"Both the read and write operations to your DynamoDB table are throttled, which are causing errors in your application. You checked the CloudWatch metrics but they indicate that the consumed capacity units haven't exceeded the provisioned capacity units. Upon further investigation, you found that the issue is caused by a ""hot partition"" in your table in which a certain partition is accessed by your downstream applications much more frequently than other partitions. What should you do to resolve this issue in your application with MINIMAL cost? (Select TWO.)",CD,CD,Increase the amount of read or write capacity for your table.,Implement read sharding to distribute workloads evenly.,Refactor your application to distribute your read and write operations as evenly as possible across your table.,Implement error retries and exponential backoff.,Use DynamoDB Accelerator (DAX).,,,"DynamoDB 테이블에 대한 읽기 및 쓰기 작업이 모두 제한되어 애플리케이션에 오류가 발생합니다. CloudWatch 지표를 확인했지만 소비된 용량 단위가 프로비저닝된 용량 단위를 초과하지 않았음을 나타냅니다. 추가 조사 결과, 다운스트림 애플리케이션이 다른 파티션보다 훨씬 더 자주 특정 파티션에 액세스하는 테이블의 ""핫 파티션""으로 인해 문제가 발생하는 것으로 나타났습니다.최소한의 비용으로 애플리케이션에서 이 문제를 해결하려면 어떻게 해야 합니까? (2개를 선택하세요.)",테이블의 읽기 또는 쓰기 용량을 늘리십시오.,워크로드를 균등하게 분산하기 위해 읽기 샤딩을 구현합니다.,읽기 및 쓰기 작업을 테이블 전체에 최대한 균등하게 분산하도록 애플리케이션을 리팩터링하세요.,오류 재시도 및 지수 백오프를 구현합니다.,DynamoDB Accelerator(DAX)를 사용합니다.,,0,,
udemy,DVA-02,243,There is a requirement to improve the performance of your serverless application in AWS by increasing the allocated CPU available for your Lambda functions. Which of the following is the MOST appropriate solution that you should implement to meet this requirement?,B,B,Manually configure the CPU settings of the Lambda function to the maximum value.,Increase the memory configuration of your function.,Configure the concurrency limit of your function to be the same as the account level concurrency limit.,Use Lambda layers to optimize the performance of the Lambda function.,,,,Lambda 함수에 사용할 수 있는 할당된 CPU를 늘려 AWS에서 서버리스 애플리케이션의 성능을 향상시켜야 한다는 요구 사항이 있습니다. 다음 중 이 요구 사항을 충족하기 위해 구현해야 하는 가장 적절한 솔루션은 무엇입니까?,Lambda 함수의 CPU 설정을 최대값으로 수동으로 구성합니다.,함수의 메모리 구성을 늘리십시오.,함수의 동시성 제한을 계정 수준 동시성 제한과 동일하게 구성하십시오.,Lambda 계층을 사용하여 Lambda 함수의 성능을 최적화합니다.,,,0,,
