exam_category,exam_type,quiz_id,en_quiz_title,most_vote,correct,en_A,en_B,en_C,en_D,en_E,en_F,en_G,ko_quiz_title,ko_A,ko_B,ko_C,ko_D,ko_E,ko_G,subject,choice_count,ko_F
udemy,DVA-02,305,"A developer wants to perform additional processing on newly inserted items in Amazon DynamoDB using AWS Lambda. In order to implement this requirement, the developer will have to use DynamoDB Streams to automatically send the new items in the table to a Lambda function for processing. Given the scenario, what steps should be performed by the developer to integrate his/her DynamoDB to his/her Lambda functions? (Select TWO.)",AE,AE,Select AWSLambdaDynamoDBExecutionRole managed policy as the function's execution role.,Create a trigger for a Kinesis Data Firehose delivery stream that uses a Lambda function for data processing.,Create an SNS topic to capture new records from DynamoDB.,Select AWSLambdaBasicExecutionRole managed policy as the function's execution role.,Create an event source mapping in Lambda to send records from your stream to a Lambda function.,,,개발자는 AWS Lambda를 사용하여 Amazon DynamoDB에 새로 삽입된 항목에 대해 추가 처리를 수행하려고 합니다. 이 요구 사항을 구현하려면 개발자는 DynamoDB Streams를 사용하여 테이블의 새 항목을 Lambda 함수로 자동 전송하여 처리해야 합니다.주어진 시나리오에서 개발자는 DynamoDB를 Lambda 함수에 통합하기 위해 어떤 단계를 수행해야 합니까? (2개를 선택하세요.),AWSLambdaDynamoDBExecutionRole함수의 실행 역할로 관리형 정책을 선택합니다 .,데이터 처리를 위해 Lambda 함수를 사용하는 Kinesis Data Firehose 전송 스트림에 대한 트리거를 생성합니다.,DynamoDB에서 새 레코드를 캡처하려면 SNS 주제를 생성하세요.,AWSLambdaBasicExecutionRole함수의 실행 역할로 관리형 정책을 선택합니다 .,Lambda에서 이벤트 소스 매핑을 생성하여 스트림의 레코드를 Lambda 함수로 보냅니다.,,0,,
udemy,DVA-02,306,A company is currently in the process of integrating their on-premises data center to their cloud infrastructure in AWS. One of the requirements is to integrate the on-premises Lightweight Directory Access Protocol (LDAP) directory service to their AWS VPC using IAM. Which of the following provides the MOST suitable solution to implement if the identity store that they are using is not compatible with SAML?,D,D,Implement the AWS Single Sign-On (SSO) service to enable single sign-on between AWS and your LDAP.,Create IAM roles to rotate the IAM credentials whenever LDAP credentials are updated.,Set up an IAM policy that references the LDAP identifiers and AWS credentials.,Create a custom identity broker application in your on-premises data center and use STS to issue short-lived AWS credentials.,,,,한 회사는 현재 온프레미스 데이터 센터를 AWS의 클라우드 인프라에 통합하는 과정을 진행 중입니다. 요구 사항 중 하나는 IAM을 사용하여 온프레미스 LDAP(Lightweight Directory Access Protocol) 디렉터리 서비스를 AWS VPC에 통합하는 것입니다.다음 중 사용 중인 ID 저장소가 SAML과 호환되지 않는 경우 구현하기에 가장 적합한 솔루션을 제공하는 것은 무엇입니까?,AWS Single Sign-On(SSO) 서비스를 구현하여 AWS와 LDAP 간의 Single Sign-On을 활성화합니다.,LDAP 자격 증명이 업데이트될 때마다 IAM 자격 증명을 교체하는 IAM 역할을 생성합니다.,LDAP 식별자와 AWS 자격 증명을 참조하는 IAM 정책을 설정합니다.,온프레미스 데이터 센터에서 사용자 지정 자격 증명 브로커 애플리케이션을 생성하고 STS를 사용하여 단기 AWS 자격 증명을 발급합니다.,,,0,,
udemy,DVA-02,307,"An aerospace engineering company has recently migrated to AWS for their cloud architecture. They are using CloudFormation and AWS SAM as deployment services for both of their monolithic and serverless applications. There is a new requirement where you have to dynamically install packages, create files, and start services on your EC2 instances upon the deployment of the application stack using CloudFormation. Which of the following helper scripts should you use in this scenario?",C,C,cfn-hup,cfn-signal,cfn-init,cfn-get-metadata,,,,"한 항공우주 엔지니어링 회사는 최근 클라우드 아키텍처를 위해 AWS로 마이그레이션했습니다. 그들은 모놀리식 애플리케이션과 서버리스 애플리케이션 모두에 대한 배포 서비스로 CloudFormation과 AWS SAM을 사용하고 있습니다. CloudFormation을 사용하여 애플리케이션 스택을 배포할 때 EC2 인스턴스에서 동적으로 패키지를 설치하고, 파일을 생성하고, 서비스를 시작해야 하는 새로운 요구 사항이 있습니다.이 시나리오에서는 다음 도우미 스크립트 중 어떤 것을 사용해야 합니까?",cfn-hup,cfn-신호,cfn-init,cfn - 가져오기 - 메타데이터,,,0,,
udemy,DVA-02,308,"You currently have an IAM user for working in the development environment using shell scripts that call the AWS CLI. The EC2 instance that you are using already contains the access key credential set and an IAM role, which are used to run the CLI and access the development environment. You were given a new set of access key credentials with another IAM role that allows you to access and manage the production environment. Which of the following is the EASIEST way to switch from one role to another?",A,A,"Create a new profile for the role in the AWS CLI configuration file then append the --profile parameter, along with the new profile name, whenever you run the CLI command.",Store the production access key credentials set in the instance metadata and call this whenever you need to access the production environment.,"Create a new instance profile in the AWS CLI configuration file then append the --profile parameter, along with the new profile name, whenever you run the CLI command.",Store the production access key credentials set in the user data of the instance and call this whenever you need to access the production environment.,,,,현재 AWS CLI를 호출하는 셸 스크립트를 사용하여 개발 환경에서 작업하는 IAM 사용자가 있습니다. 사용 중인 EC2 인스턴스에는 CLI를 실행하고 개발 환경에 액세스하는 데 사용되는 액세스 키 자격 증명 세트와 IAM 역할이 이미 포함되어 있습니다. 프로덕션 환경에 액세스하고 관리할 수 있는 다른 IAM 역할과 함께 새로운 액세스 키 자격 증명 세트가 제공되었습니다.다음 중 한 역할에서 다른 역할로 전환하는 가장 쉬운 방법은 무엇입니까?,AWS CLI 구성 파일에서 역할에 대한 새 프로필을 생성한 다음 --profileCLI 명령을 실행할 때마다 새 프로필 이름과 함께 파라미터를 추가합니다.,인스턴스 메타데이터에 설정된 프로덕션 액세스 키 자격 증명을 저장하고 프로덕션 환경에 액세스해야 할 때마다 이를 호출합니다.,AWS CLI 구성 파일에서 새 인스턴스 프로필을 생성한 다음 --profileCLI 명령을 실행할 때마다 새 프로필 이름과 함께 파라미터를 추가합니다.,인스턴스의 사용자 데이터에 설정된 프로덕션 액세스 키 자격 증명을 저장하고 프로덕션 환경에 액세스해야 할 때마다 이를 호출합니다.,,,0,,
udemy,DVA-02,309,"A developer is utilizing AWS X-Ray to generate a visual representation of the requests flowing through their enterprise web application. Since the application interacts with multiple services, all requests must be traced in X-Ray, including any downstream calls made to AWS resources.Which of the following actions should the developer implement for this scenario?",A,A,"Use X-Ray SDK to generate segment documents with subsegments and send them to the X-Ray daemon, which will buffer them and upload to the X-Ray API in batches.",Install AWS X-Ray on the different services that communicate with the application including the AWS resources that the application calls.,Use AWS X-Ray SDK to upload a trace segment by executing PutTraceSegments API.,Pass multiple trace segments as a parameter of PutTraceSegments API.,,,,개발자는 AWS X-Ray를 활용하여 엔터프라이즈 웹 애플리케이션을 통해 흐르는 요청을 시각적으로 표현하고 있습니다. 애플리케이션은 여러 서비스와 상호 작용하므로 AWS 리소스에 대한 다운스트림 호출을 포함하여 모든 요청을 X-Ray에서 추적해야 합니다.이 시나리오에서 개발자는 다음 중 어떤 작업을 구현해야 합니까?,X-Ray SDK를 사용하여 하위 세그먼트가 포함된 세그먼트 문서를 생성하고 X-Ray 데몬으로 보내면 X-Ray 데몬이 이를 버퍼링하고 X-Ray API에 일괄 업로드합니다.,애플리케이션이 호출하는 AWS 리소스를 포함하여 애플리케이션과 통신하는 다양한 서비스에 AWS X-Ray를 설치합니다.,API 를 실행하여 추적 세그먼트를 업로드하려면 AWS X-Ray SDK를 사용하십시오 PutTraceSegments.,여러 추적 세그먼트를 API의 매개변수로 전달합니다 PutTraceSegments.,,,0,,
udemy,DVA-02,310,"A web application is currently using an on-premises Microsoft SQL Server 2019 Enterprise Edition database. Your manager instructed you to migrate the application to Elastic Beanstalk and the database to RDS. For additional security, you must configure your database to automatically encrypt data before it is written to storage, and automatically decrypt data when the data is read from storage.Which of the following services will you use to achieve this?",B,B,Use Microsoft SQL Server Windows Authentication.,Enable Transparent Data Encryption (TDE).,Enable RDS Encryption.,Use IAM DB Authentication.,,,,"웹 애플리케이션은 현재 온프레미스 Microsoft SQL Server 2019 Enterprise Edition 데이터베이스를 사용하고 있습니다. 관리자는 애플리케이션을 Elastic Beanstalk로, 데이터베이스를 RDS로 마이그레이션하라고 지시했습니다. 보안을 강화하려면 데이터를 스토리지에 쓰기 전에 자동으로 암호화하고 스토리지에서 데이터를 읽을 때 데이터를 자동으로 해독하도록 데이터베이스를 구성해야 합니다.이를 달성하기 위해 다음 중 어떤 서비스를 사용하시겠습니까?",Microsoft SQL Server Windows 인증을 사용합니다.,TDE(투명한 데이터 암호화)를 활성화합니다.,RDS 암호화를 활성화합니다.,IAM DB 인증을 사용합니다.,,,0,,
udemy,DVA-02,311,"The infrastructure of an application is designed such that a producer sends data to a consumer via HTTPS. The consumer may sometimes take a while to process the messages, which can result in unexpected timeouts and cause newer messages not to be acknowledged immediately. To resolve this issue, a developer decided to introduce an Amazon SQS standard queue into the system. However, duplicate messages are still not being handled properly.What should the developer do to ensure that messages are durably delivered and to prevent duplicate messages? (Select TWO.)",BC,BC,Use a delay queue.,Create a FIFO queue as a replacement for the standard queue.,Configure the producer to set deduplication IDs for the messages.,Increase the timeout for the acknowledgement response.,Increase the number of consumers polling from your standard queue.,,,애플리케이션의 인프라는 생산자가 HTTPS를 통해 소비자에게 데이터를 보내도록 설계되었습니다. 소비자가 메시지를 처리하는 데 시간이 걸릴 수 있으며 이로 인해 예기치 않은 시간 초과가 발생하고 새 메시지가 즉시 승인되지 않을 수 있습니다. 이 문제를 해결하기 위해 개발자는 Amazon SQS 표준 대기열을 시스템에 도입하기로 결정했습니다. 그러나 중복된 메시지는 여전히 제대로 처리되지 않고 있습니다.메시지가 지속적으로 전달되도록 하고 중복 메시지를 방지하려면 개발자는 무엇을 해야 합니까? (2개를 선택하세요.),지연 대기열을 사용합니다.,표준 대기열 대신 FIFO 대기열을 생성합니다.,메시지에 대한 중복 제거 ID를 설정하도록 생산자를 구성합니다.,승인 응답에 대한 시간 제한을 늘립니다.,표준 대기열에서 폴링하는 소비자 수를 늘립니다.,,0,,
udemy,DVA-02,312,"You were recently hired by a media company that is planning to build a news portal using Elastic Beanstalk and DynamoDB database, which already contains a few data. There is already an existing DynamoDB Table that has an attribute of ArticleName which acts as the partition key and a Category attribute as its sort key. You are instructed to develop a feature that will query the ArticleName attribute but will use a different sort key other than the existing one. The feature also requires strong read consistency to fetch the most up-to-date data.Which of the following solutions should you implement?",A,A,Create a new DynamoDB table with a Local Secondary Index that uses the ArticleName attribute with a different sort key. Migrate the data from the existing table to the new table.,Create a Local Secondary Index that uses the ArticleName attribute and a different sort key.,Create a Global Secondary Index that uses the ArticleName attribute and a different sort key.,Create a Global Secondary Index which uses the ArticleName attribute and your alternative sort key as projected attributes.,,,,귀하는 이미 몇 가지 데이터가 포함된 Elastic Beanstalk 및 DynamoDB 데이터베이스를 사용하여 뉴스 포털을 구축하려는 미디어 회사에 최근 고용되었습니다. ArticleName파티션 키 역할을 하는 속성과 Category정렬 키 역할을 하는 속성을 가진 기존 DynamoDB 테이블이 이미 있습니다 . ArticleName속성을 쿼리하지만 기존 정렬 키와 다른 정렬 키를 사용하는 기능을 개발하라는 지시를 받았습니다 . 또한 이 기능은 최신 데이터를 가져오기 위해 강력한 읽기 일관성이 필요합니다.다음 중 어떤 솔루션을 구현해야 합니까?,ArticleName다른 정렬 키가 있는 속성을 사용하는 로컬 보조 인덱스가 있는 새 DynamoDB 테이블을 생성합니다 . 기존 테이블의 데이터를 새 테이블로 마이그레이션합니다.,ArticleName해당 속성과 다른 정렬 키를 사용하는 로컬 보조 인덱스를 생성합니다 .,ArticleName속성과 다른 정렬 키를 사용하는 글로벌 보조 인덱스를 생성합니다 .,ArticleName속성과 대체 정렬 키를 예상 속성으로 사용하는 글로벌 보조 인덱스를 생성합니다 .,,,0,,
udemy,DVA-02,313,Your request to increase your account's concurrent execution limit to 2000 has been recently approved by AWS. There are 10 Lambda functions running in your account and you already specified a concurrency execution limit on one function at 400 and on another function at 200. Which of the following statements are TRUE in this scenario? (Select TWO.),BC,BC,The unreserved concurrency pool is 600.,The remaining 1400 concurrent executions will be shared among the other 8 functions.,You can still set a concurrency execution limit of 1300 to a third Lambda function.,The combined allocated 600 concurrent execution will be shared among the 2 functions.,You can still set a concurrency execution limit of 1400 to a third Lambda function.,,,계정의 동시 실행 한도를 2000으로 늘리려는 귀하의 요청이 최근 AWS에서 승인되었습니다. 계정에서 10개의 Lambda 함수가 실행 중이고 이미 한 함수에 대해 동시 실행 제한을 400으로 지정했고 다른 함수에는 200으로 동시 실행 제한을 지정했습니다.이 시나리오에서 다음 설명 중 참인 것은 무엇입니까? (2개를 선택하세요.),예약되지 않은 동시성 풀은 600입니다.,나머지 1400개의 동시 실행은 다른 8개 기능에서 공유됩니다.,세 번째 Lambda 함수에 동시 실행 제한을 1300으로 설정할 수 있습니다.,결합된 할당된 600개의 동시 실행은 두 기능 간에 공유됩니다.,세 번째 Lambda 함수에 동시 실행 제한을 1400으로 설정할 수 있습니다.,,0,,
udemy,DVA-02,314,A company has an application hosted in an On-Demand EC2 instance in your VPC. The developer has been instructed to create a shell script that fetches the instance's associated public and private IP addresses. What should the developer do to complete this task?,B,B,Get the public and private IP addresses from the instance user data service using the http://169.254.169.254/latest/userdata/ endpoint.,Get the public and private IP addresses from the instance metadata service using the http://169.254.169.254/latest/meta-data/ endpoint.,Get the public and private IP addresses from Amazon CloudWatch.,Get the public and private IP addresses from AWS CloudTrail.,,,,회사에는 VPC의 온디맨드 EC2 인스턴스에 호스팅되는 애플리케이션이 있습니다. 개발자는 인스턴스의 연결된 공용 및 개인 IP 주소를 가져오는 셸 스크립트를 생성하라는 지시를 받았습니다.이 작업을 완료하려면 개발자가 무엇을 해야 합니까?,엔드포인트 를 사용하여 인스턴스 사용자 데이터 서비스에서 퍼블릭 및 프라이빗 IP 주소를 가져옵니다 http://169.254.169.254/latest/userdata/.,엔드포인트 를 사용하여 인스턴스 메타데이터 서비스에서 퍼블릭 및 프라이빗 IP 주소를 가져옵니다 http://169.254.169.254/latest/meta-data/.,Amazon CloudWatch에서 퍼블릭 및 프라이빗 IP 주소를 가져옵니다.,AWS CloudTrail에서 퍼블릭 및 프라이빗 IP 주소를 가져옵니다.,,,0,,
udemy,DVA-02,315,"You are working for a software development company that uses AWS CodePipeline as their CI/CD platform to build, test, and push their deployments to their production environment. You have created a Lambda function that will push the build details on a separate DynamoDB table. You want to trigger this function after a successful build on your Pipeline.Which of the following services will help you achieve this?",A,A,Amazon EventBridge,AWS OpsWorks,AWS CodeBuild,AWS CloudTrail Events,,,,"귀하는 AWS CodePipeline을 CI/CD 플랫폼으로 사용하여 배포를 구축, 테스트하고 프로덕션 환경에 푸시하는 소프트웨어 개발 회사에서 일하고 있습니다. 별도의 DynamoDB 테이블에 빌드 세부 정보를 푸시하는 Lambda 함수를 생성했습니다. 파이프라인에서 성공적인 빌드 후에 이 함수를 트리거하려고 합니다.다음 중 어떤 서비스가 이를 달성하는 데 도움이 됩니까?",아마존 이벤트브리지,AWS OpsWorks,AWS 코드빌드,AWS CloudTrail 이벤트,,,0,,
udemy,DVA-02,316,"A company has an application hosted in an ECS Cluster that heavily uses an RDS database. A developer needs to closely monitor how the different processes on a DB instance use the CPU, such as the percentage of the CPU bandwidth or the total memory consumed by each process to ensure application performance.Which of the following is the MOST suitable solution that the developer should implement?",D,D,Use CloudWatch to track the CPU Utilization of your database.,Develop a shell script that collects and publishes custom metrics to CloudWatch which tracks the real-time CPU Utilization of the RDS instance.,Track the CPU% and MEM% metrics which are readily available in the Amazon RDS console.,Use Enhanced Monitoring in RDS.,,,,한 회사에 RDS 데이터베이스를 많이 사용하는 ECS 클러스터에 호스팅되는 애플리케이션이 있습니다. 개발자는 애플리케이션 성능을 보장하기 위해 CPU 대역폭 비율이나 각 프로세스에서 소비하는 총 메모리 등 DB 인스턴스의 다양한 프로세스가 CPU를 사용하는 방식을 면밀히 모니터링해야 합니다.다음 중 개발자가 구현해야 하는 가장 적합한 솔루션은 무엇입니까?,CloudWatch를 사용하여 데이터베이스의 CPU 사용률을 추적하십시오.,RDS 인스턴스의 실시간 CPU 사용률을 추적하는 CloudWatch에 사용자 지정 지표를 수집하고 게시하는 셸 스크립트를 개발합니다.,Amazon RDS 콘솔에서 쉽게 사용할 수 있는 지표를 CPU%추적 합니다 .MEM%,RDS에서 향상된 모니터링을 사용하세요.,,,0,,
udemy,DVA-02,317,"A developer is planning to build a serverless Rust application in AWS using AWS Lambda and Amazon DynamoDB. Much to his disappointment, AWS Lambda does not natively support the Rust programming language. Can the developer still proceed with creating serverless Rust applications in AWS given the situation above?",B,B,No. The developer will have to wait for a new support release in AWS Lambda.,Yes. The developer can create a custom runtime for hist Rust applications and bootstrap it to an AWS Lambda function.,Yes. The developer will just have to use AWS Fargate instead of AWS Lambda.,Yes. The developer can submit a request ticket to AWS so that they can provide him a Lambda runtime environment that supports Rust.,,,,개발자는 AWS Lambda 및 Amazon DynamoDB를 사용하여 AWS에서 서버리스 Rust 애플리케이션을 구축할 계획입니다. 실망스럽게도 AWS Lambda는 기본적으로 Rust 프로그래밍 언어를 지원하지 않습니다.위의 상황에서 개발자가 AWS에서 서버리스 Rust 애플리케이션 생성을 계속 진행할 수 있습니까?,아니요. 개발자는 AWS Lambda의 새로운 지원 릴리스를 기다려야 합니다.,예. 개발자는 자신의 Rust 애플리케이션에 대한 사용자 지정 런타임을 생성하고 이를 AWS Lambda 함수로 부트스트랩할 수 있습니다.,예. 개발자는 AWS Lambda 대신 AWS Fargate를 사용하면 됩니다.,예. 개발자는 AWS에 요청 티켓을 제출하여 Rust를 지원하는 Lambda 런타임 환경을 제공할 수 있습니다.,,,0,,
udemy,DVA-02,318,"A developer is building an AI-based traffic monitoring application using Lambda in AWS. Due to the complexity of the application, the developer must do certain modifications such as the way Lambda runs the function's setup code and how the invocation events are read from the Lambda runtime API. In this scenario, which feature of Lambda should you take advantage of to meet the above requirement?",A,A,Custom Runtime,Layers,Lambda@Edge,DLQ,,,,"개발자는 AWS에서 Lambda를 사용하여 AI 기반 트래픽 모니터링 애플리케이션을 구축하고 있습니다. 애플리케이션의 복잡성으로 인해 개발자는 Lambda가 함수의 설정 코드를 실행하는 방식, Lambda 런타임 API에서 호출 이벤트를 읽는 방식 등 특정 수정을 수행해야 합니다.이 시나리오에서 위 요구 사항을 충족하려면 Lambda의 어떤 기능을 활용해야 합니까?",커스텀 런타임,레이어,람다@에지,DLQ,,,0,,
udemy,DVA-02,319,"You have two users concurrently accessing a DynamoDB table and submitting updates. If a user will modify a specific item in the table, she needs to make sure that the operation will not affect another user's attempt to modify the same item. You have to ensure that your update operations will only succeed if the item attributes meet one or more expected conditions. Which of the following DynamoDB features should you use in this scenario?",A,A,Conditional writes,Projection Expressions,Batch Operations,Update Expressions,,,,DynamoDB 테이블에 동시에 액세스하고 업데이트를 제출하는 두 명의 사용자가 있습니다. 사용자가 테이블의 특정 항목을 수정하는 경우 해당 작업이 동일한 항목을 수정하려는 다른 사용자의 시도에 영향을 미치지 않는지 확인해야 합니다. 항목 속성이 하나 이상의 예상 조건을 충족하는 경우에만 업데이트 작업이 성공하도록 해야 합니다.이 시나리오에서는 다음 DynamoDB 기능 중 어떤 기능을 사용해야 합니까?,조건부 쓰기,투영식,일괄 작업,표현식 업데이트,,,0,,
udemy,DVA-02,320,"You work for a software development company where the teams are divided into distinct projects. The management wants to have separation on their AWS resources, which will have a detailed report on the costs of each project. Which of the following options is the recommended way to implement this?",A,A,Create separate AWS accounts for each project and use consolidated billing.,Tag resources by projects and use Detailed Billing Reports to show costing per tag.,Tag resources by IAM group assigned for each project and use Detailed Billing reports to show costing.,Create separate AWS accounts for each project and generate Detailed Billing for each account.,,,,당신은 팀이 서로 다른 프로젝트로 나누어져 있는 소프트웨어 개발 회사에서 일하고 있습니다. 경영진은 AWS 리소스를 분리하여 각 프로젝트 비용에 대한 자세한 보고서를 원합니다.다음 옵션 중 이를 구현하는 데 권장되는 방법은 무엇입니까?,프로젝트마다 별도의 AWS 계정을 생성하고 통합 결제를 사용하세요.,프로젝트별로 리소스에 태그를 지정하고 세부 청구 보고서를 사용하여 태그당 비용을 표시합니다.,각 프로젝트에 할당된 IAM 그룹별로 리소스에 태그를 지정하고 세부 결제 보고서를 사용하여 비용을 표시합니다.,각 프로젝트에 대해 별도의 AWS 계정을 생성하고 각 계정에 대한 세부 결제를 생성합니다.,,,0,,
