exam_category,exam_type,quiz_id,en_quiz_title,most_vote,correct,en_A,en_B,en_C,en_D,en_E,en_F,en_G,ko_quiz_title,ko_A,ko_B,ko_C,ko_D,ko_E,ko_G,subject,choice_count,ko_F
udemy,DVA-02,148,"You have an Amazon Kinesis data stream which has 20 open shards and 5 EC2 instances running as Kinesis Client Library (KCL) workers. Upon monitoring the metrics of your application in CloudWatch, it shows that your EC2 workers are consuming all of their CPU resources when processing the shards. Which of the following is the BEST solution to optimize your application and prevent workers from maxing out their CPU resources?",C,C,Launch an additional 20 instances,Launch an additional 25 instances,Launch an additional 15 instances,Decrease the number of shards that each instance processes,,,,오픈 샤드 20개와 ​​KCL(Kinesis Client Library) 작업자로 실행되는 EC2 인스턴스 5개가 있는 Amazon Kinesis 데이터 스트림이 있습니다. CloudWatch에서 애플리케이션 지표를 모니터링하면 EC2 작업자가 샤드를 처리할 때 CPU 리소스를 모두 소비하고 있음을 알 수 있습니다.다음 중 애플리케이션을 최적화하고 작업자가 CPU 리소스를 최대화하는 것을 방지하는 가장 좋은 솔루션은 무엇입니까?,추가로 20개의 인스턴스 시작,추가로 25개의 인스턴스 시작,추가로 15개의 인스턴스 시작,각 인스턴스가 처리하는 샤드 수 감소,,,0,,
udemy,DVA-02,149,"A company has a website hosted in a multicontainer Docker environment in Elastic Beanstalk. There is a requirement to integrate the website with API Gateway, where it simply passes client-submitted method requests to the backend. It is important that the client and backend interact directly with no intervention from API Gateway after the API method is set up, except for known issues such as unsupported characters. Which of the following integration types is the MOST suitable one to use to meet this requirement?",D,D,AWS_PROXY,AWS,HTTP,HTTP_PROXY,,,,회사에는 Elastic Beanstalk의 다중 컨테이너 Docker 환경에서 호스팅되는 웹 사이트가 있습니다. 클라이언트가 제출한 메서드 요청을 백엔드에 전달하는 API 게이트웨이와 웹사이트를 통합해야 한다는 요구 사항이 있습니다. 지원되지 않는 문자와 같은 알려진 문제를 제외하고 API 메서드가 설정된 후 API 게이트웨이의 개입 없이 클라이언트와 백엔드가 직접 상호 작용하는 것이 중요합니다.다음 중 이 요구 사항을 충족하는 데 사용하기에 가장 적합한 통합 유형은 무엇입니까?,AWS_PROXY,AWS,HTTP,HTTP_PROXY,,,0,,
udemy,DVA-02,150,"A company is heavily using a range of AWS services to host their enterprise applications. Currently, their deployment process still has a lot of manual steps which is why they plan to automate their software delivery process using continuous integration and delivery (CI/CD) pipelines in AWS. They will use CodePipeline to orchestrate each step of their release process and CodeDeploy for deploying applications to various compute platforms in AWS. In this architecture, which of the following are valid considerations when using CodeDeploy? (Select TWO.)",AC,AC,CodeDeploy can deploy applications to both your EC2 instances as well as your on-premises servers.,You have to install and use the CodeDeploy agent installed on your EC2 instances and ECS cluster.,AWS Lambda compute platform deployments cannot use an in-place deployment type.,"CodeDeploy can deploy applications to EC2, AWS Lambda, and Amazon ECS only.",The CodeDeploy agent communicates using HTTP over port 80.,,,한 회사는 엔터프라이즈 애플리케이션을 호스팅하기 위해 다양한 AWS 서비스를 많이 사용하고 있습니다. 현재 배포 프로세스에는 여전히 수동 단계가 많기 때문에 AWS의 CI/CD(지속적 통합 및 전달) 파이프라인을 사용하여 소프트웨어 제공 프로세스를 자동화할 계획입니다. CodePipeline을 사용하여 릴리스 프로세스의 각 단계를 조정하고 CodeDeploy를 사용하여 AWS의 다양한 컴퓨팅 플랫폼에 애플리케이션을 배포합니다.이 아키텍처에서 CodeDeploy를 사용할 때 다음 중 유효한 고려 사항은 무엇입니까? (2개를 선택하세요.),CodeDeploy는 EC2 인스턴스와 온프레미스 서버 모두에 애플리케이션을 배포할 수 있습니다.,EC2 인스턴스 및 ECS 클러스터에 설치된 CodeDeploy 에이전트를 설치하고 사용해야 합니다.,AWS Lambda 컴퓨팅 플랫폼 배포에서는 전체 배포 유형을 사용할 수 없습니다.,"CodeDeploy는 EC2, AWS Lambda 및 Amazon ECS에만 애플리케이션을 배포할 수 있습니다.",CodeDeploy 에이전트는 포트 80을 통해 HTTP를 사용하여 통신합니다.,,0,,
udemy,DVA-02,151,"A developer is instrumenting an application that will be hosted in a large On-Demand EC2 instance in AWS. All of the downstream calls invoked by the application must be traced properly, including the AWS SDK calls. A user-defined data should also be present to expedite the troubleshooting process.Which of the following are valid considerations in AWS X-Ray that the developer should follow? (Select TWO.)",BC,BC,Set the annotations object with any additional custom data that you want to store in the segment.,Set the namespace subsegment field to aws for AWS SDK calls and remote for other downstream calls.,Set the metadata object with any additional custom data that you want to store in the segment.,Set the namespace subsegment field to remote for AWS SDK calls and aws for other downstream calls.,Set the metadata object with key-value pairs that you want X-Ray to index for search.,,,개발자가 AWS의 대규모 온디맨드 EC2 인스턴스에서 호스팅될 애플리케이션을 계측하고 있습니다. AWS SDK 호출을 포함하여 애플리케이션에서 호출한 모든 다운스트림 호출을 올바르게 추적해야 합니다. 문제 해결 프로세스를 신속하게 처리하려면 사용자 정의 데이터도 있어야 합니다.다음 중 개발자가 따라야 하는 AWS X-Ray의 유효한 고려 사항은 무엇입니까? (2개를 선택하세요.),annotations세그먼트에 저장하려는 추가 사용자 정의 데이터로 개체를 설정합니다 .,AWS SDK 호출 및 기타 다운스트림 호출의 경우 namespace하위 세그먼트 필드를 로 설정합니다 .awsremote,metadata세그먼트에 저장하려는 추가 사용자 정의 데이터로 개체를 설정합니다 .,AWS SDK 호출 및 기타 다운스트림 호출의 경우 namespace하위 세그먼트 필드를 로 설정합니다 .remoteaws,metadataX-Ray가 검색을 위해 인덱싱할 키-값 쌍으로 객체를 설정합니다 .,,0,,
udemy,DVA-02,152,"A prototype application is hosted in an EC2 instance, which has an assigned IAM Role to store data from both the development and production S3 buckets. The instance also has AWS CLI access/secret key installed to handle other ad hoc tasks. You assigned a new IAM Role to the instance which has the permission to access the development bucket only. However, upon testing, the instance can still store files to both buckets.What is the MOST likely root cause of this issue?",D,D,The new IAM Role has an attached inline policy.,"Due to eventual consistency, you must wait 24 hours for the change to appear across all of AWS.",The instance profile role of a running EC2 instance is static and can't be replaced at all.,The application is still using the IAM role that is configured for the AWS CLI key.,,,,프로토타입 애플리케이션은 개발 및 프로덕션 S3 버킷 모두의 데이터를 저장하기 위해 IAM 역할이 할당된 EC2 인스턴스에서 호스팅됩니다. 또한 인스턴스에는 다른 임시 작업을 처리하기 위해 AWS CLI 액세스/비밀 키가 설치되어 있습니다. 개발 버킷에만 액세스할 수 있는 권한이 있는 인스턴스에 새 IAM 역할을 할당했습니다. 그러나 테스트 시 인스턴스는 여전히 두 버킷에 모두 파일을 저장할 수 있습니다.이 문제의 가장 가능성 있는 근본 원인은 무엇입니까?,새로운 IAM 역할에는 인라인 정책이 첨부되어 있습니다.,최종 일관성으로 인해 변경 사항이 AWS 전체에 나타날 때까지 24시간을 기다려야 합니다.,실행 중인 EC2 인스턴스의 인스턴스 프로파일 역할은 정적이며 전혀 대체될 수 없습니다.,애플리케이션은 여전히 ​​AWS CLI 키에 대해 구성된 IAM 역할을 사용하고 있습니다.,,,0,,
udemy,DVA-02,153,"The CTO of a startup needs a version control system for collaborative software development. The system must support version tracking, parallel branching, pull requests, and batch changes across multiple files. Which AWS service will meet these requirements?",B,B,AWS CodeBuild,AWS CodeCommit,AWS CodeStar,AWS CodeDeploy,,,,"스타트업의 CTO에게는 협업 소프트웨어 개발을 위한 버전 관리 시스템이 필요합니다. 시스템은 여러 파일에 걸쳐 버전 추적, 병렬 분기, 끌어오기 요청 및 일괄 변경을 지원해야 합니다.이러한 요구 사항을 충족하는 AWS 서비스는 무엇입니까?",AWS 코드빌드,AWS 코드커밋,AWS 코드스타,AWS 코드배포,,,0,,
udemy,DVA-02,154,"A company has different AWS accounts, namely Account A, Account B, and Account C, which are used for their Development, Test, and Production environments respectively. A developer needs access to perform an audit whenever a new version of the application has been deployed to the Test (Account B) and production (Account C) environments. What is the MOST efficient way to provide the developer access to execute the specified task?",C,C,Set up AWS Organizations and attach a Service Control Policy to the developer to access the other accounts.,Enable AWS multi-factor authentication (MFA) to the IAM User of the developer.,Grant the developer cross-account access to the resources of Accounts B and C.,Create separate identities and passwords for the developer on both the Test and Production accounts.,,,,"회사에는 개발, 테스트 및 프로덕션 환경에 각각 사용되는 계정 A, 계정 B 및 계정 C라는 다양한 AWS 계정이 있습니다. 개발자는 새 버전의 애플리케이션이 테스트(계정 B) 및 프로덕션(계정 C) 환경에 배포될 때마다 감사를 수행할 수 있는 액세스 권한이 필요합니다.개발자에게 지정된 작업을 실행할 수 있는 액세스 권한을 제공하는 가장 효율적인 방법은 무엇입니까?",AWS Organizations를 설정하고 서비스 제어 정책을 개발자에게 연결하여 다른 계정에 액세스합니다.,개발자의 IAM 사용자에게 AWS Multi-Factor Authentication(MFA)을 활성화합니다.,개발자에게 계정 B와 C의 리소스에 대한 교차 계정 액세스 권한을 부여합니다.,테스트 계정과 프로덕션 계정 모두에서 개발자를 위한 별도의 ID와 비밀번호를 만듭니다.,,,0,,
udemy,DVA-02,155,"A serverless application is using API Gateway with a non-proxy Lambda Integration. A developer was tasked to expose a GET method on a new /getcourses resource to invoke the Lambda function, which will allow the consumers to fetch a list of online courses in JSON format. The consumers must include a query string parameter named courseType in their request to get the data. What is the MOST efficient solution that the developer should do to accomplish this requirement?",A,A,Configure the method request of the resource.,Configure the integration request of the resource.,Configure the method response of the resource.,Configure the integration response of the resource.,,,,서버리스 애플리케이션은 프록시가 아닌 Lambda 통합과 함께 API 게이트웨이를 사용하고 있습니다. /getcourses개발자 는 소비자가 JSON 형식으로 온라인 강좌 목록을 가져올 수 있도록 하는 Lambda 함수를 호출하기 위해 새 리소스에 GET 메서드를 노출하는 작업을 맡았습니다 . 소비자는 courseType데이터를 가져오기 위해 요청에 명명된 쿼리 문자열 매개 변수를 포함해야 합니다.이 요구 사항을 달성하기 위해 개발자가 수행해야 하는 가장 효율적인 솔루션은 무엇입니까?,리소스의 메서드 요청을 구성합니다.,리소스의 통합 요청을 구성합니다.,리소스의 메서드 응답을 구성합니다.,리소스의 통합 응답을 구성합니다.,,,0,,
udemy,DVA-02,156,"A developer is instructed to collect data on the number of times that web visitors click the advertisement link of a popular news website. A database entry containing the count will be incremented for every click. Given that the website has millions of readers worldwide, your database should be configured to provide optimal performance to capture all the click events. What is the BEST service that the developer should implement in this scenario?",C,C,Launch an Amazon Redshift for the database and apply a step count of 1 for the IDENTITY column.,Use Amazon RDS for the database and setup SQL AUTO_INCREMENT on your tables.,Set up Amazon DynamoDB for the database and implement atomic counters for UpdateItem operation of the website counter.,Take advantage of Amazon Aurora's performance speed and AUTO_INCREMENT feature for item updates.,,,,개발자는 웹 방문자가 인기 뉴스 웹사이트의 광고 링크를 클릭하는 횟수에 대한 데이터를 수집하라는 지시를 받습니다. 클릭할 때마다 개수가 포함된 데이터베이스 항목이 증가합니다. 웹사이트에는 전 세계적으로 수백만 명의 독자가 있다는 점을 고려하면 모든 클릭 이벤트를 캡처할 수 있는 최적의 성능을 제공하도록 데이터베이스를 구성해야 합니다.이 시나리오에서 개발자가 구현해야 하는 가장 좋은 서비스는 무엇입니까?,데이터베이스에 대해 Amazon Redshift를 시작하고 IDENTITY 열에 단계 수 1을 적용합니다.,데이터베이스에 Amazon RDS를 사용하고 테이블에 SQL AUTO_INCREMENT를 설정하세요.,데이터베이스용 Amazon DynamoDB를 설정하고 UpdateItem웹사이트 카운터 작동을 위한 원자 카운터를 구현합니다.,Amazon Aurora의 성능 속도와 항목 업데이트를 위한 AUTO_INCREMENT 기능을 활용하세요.,,,0,,
udemy,DVA-02,157,An application has recently been migrated from an on-premises data center to a development Elastic Beanstalk environment. A developer will do iterative tests and therefore needs to deploy code changes and view them as quickly as possible.Which of the following options take the LEAST amount of time to complete the deployment?,D,D,Immutable,Rolling with additional batch,Rolling,All at once,,,,최근 애플리케이션이 온프레미스 데이터 센터에서 개발 Elastic Beanstalk 환경으로 마이그레이션되었습니다. 개발자는 반복 테스트를 수행하므로 코드 변경 사항을 배포하고 가능한 한 빨리 확인해야 합니다.다음 옵션 중 배포를 완료하는 데 가장 짧은 시간이 걸리는 옵션은 무엇입니까?,불변,추가 배치로 롤링,구르는,한꺼번에,,,0,,
udemy,DVA-02,158,"An application in your development account is running in an AWS Elastic Beanstalk environment which has an attached Amazon RDS database. You noticed that if you terminate the environment, it also brings down the database which hinders you from performing seamless updates with blue-green deployments. This also poses a critical security risk if the company decides to deploy the application in production. In this scenario, how can you decouple your database instance from your environment without having any data loss?",A,A,"Use the blue / green deployment strategy to decouple the Amazon RDS instance from your Elastic Beanstalk environment. Create an RDS DB snapshot of the database and enable deletion protection. Create a new Elastic Beanstalk environment with the necessary information to connect to the Amazon RDS instance. Before terminating the old Elastic Beanstalk environment, remove its security group rule first before proceeding.",Use the blue / green deployment strategy to decouple the Amazon RDS instance from your Elastic Beanstalk environment. Create an RDS DB snapshot of the database and enable deletion protection. Create a new Elastic Beanstalk environment with the necessary information to connect to the Amazon RDS instance and delete the old environment.,Use a Canary deployment strategy to decouple the Amazon RDS instance from your Elastic Beanstalk environment. Create an RDS DB snapshot of the database and enable deletion protection. Create a new Elastic Beanstalk environment with the necessary information to connect to the Amazon RDS instance and delete the old environment.,Use a Canary deployment strategy to decouple the Amazon RDS instance from your Elastic Beanstalk environment. Create an RDS DB snapshot of the database and then create a new Elastic Beanstalk environment with the necessary information to connect to the Amazon RDS instance.,,,,개발 계정의 애플리케이션은 Amazon RDS 데이터베이스가 연결된 AWS Elastic Beanstalk 환경에서 실행되고 있습니다. 환경을 종료하면 데이터베이스도 다운되어 블루-그린 배포를 통해 원활한 업데이트를 수행하는 데 방해가 된다는 사실을 확인했습니다. 이는 회사가 프로덕션 환경에 애플리케이션을 배포하기로 결정한 경우에도 심각한 보안 위험을 초래합니다.이 시나리오에서 데이터 손실 없이 어떻게 데이터베이스 인스턴스를 환경에서 분리할 수 있습니까?,블루/그린 배포 전략을 사용하여 Elastic Beanstalk 환경에서 Amazon RDS 인스턴스를 분리합니다. 데이터베이스의 RDS DB 스냅샷을 생성하고 삭제 보호를 활성화합니다. Amazon RDS 인스턴스에 연결하는 데 필요한 정보로 새로운 Elastic Beanstalk 환경을 생성합니다. 이전 Elastic Beanstalk 환경을 종료하기 전에 먼저 보안 그룹 규칙을 제거한 후 진행하세요.,블루/그린 배포 전략을 사용하여 Elastic Beanstalk 환경에서 Amazon RDS 인스턴스를 분리합니다. 데이터베이스의 RDS DB 스냅샷을 생성하고 삭제 보호를 활성화합니다. Amazon RDS 인스턴스에 연결하고 이전 환경을 삭제하는 데 필요한 정보로 새 Elastic Beanstalk 환경을 생성합니다.,Canary 배포 전략을 사용하여 Elastic Beanstalk 환경에서 Amazon RDS 인스턴스를 분리합니다. 데이터베이스의 RDS DB 스냅샷을 생성하고 삭제 보호를 활성화합니다. Amazon RDS 인스턴스에 연결하고 이전 환경을 삭제하는 데 필요한 정보로 새 Elastic Beanstalk 환경을 생성합니다.,Canary 배포 전략을 사용하여 Elastic Beanstalk 환경에서 Amazon RDS 인스턴스를 분리합니다. 데이터베이스의 RDS DB 스냅샷을 생성한 다음 Amazon RDS 인스턴스에 연결하는 데 필요한 정보로 새로운 Elastic Beanstalk 환경을 생성합니다.,,,0,,
udemy,DVA-02,159,"A developer is preparing the application specification (AppSpec) file in CodeDeploy, which will be used to deploy her Lambda functions to AWS. In the deployment, she needs to configure CodeDeploy to run a task before the traffic is shifted to the deployed Lambda function version. Which deployment lifecycle event should she configure in this scenario?",B,B,Start,BeforeAllowTraffic,BeforeInstall,Install,,,,AppSpec개발자는 AWS에 Lambda 함수를 배포하는 데 사용될 CodeDeploy에서 애플리케이션 사양( ) 파일을 준비하고 있습니다 . 배포 시 그녀는 트래픽이 배포된 Lambda 함수 버전으로 이동하기 전에 작업을 실행하도록 CodeDeploy를 구성해야 합니다.이 시나리오에서는 어떤 배포 수명 주기 이벤트를 구성해야 합니까?,시작,이전에 트래픽 허용,설치 전,설치하다,,,0,,
udemy,DVA-02,160,A mobile game is currently being developed and needs to have an authentication service. You need to use an AWS service which provides temporary AWS credentials for users who have been authenticated via their social media logins as well as for guest users who do not require any authentication. How can you BEST achieve this using AWS?,B,B,Use Amazon Cognito Sync.,Use AWS Cognito Identity Pools then enable access to unauthenticated identities.,Use AWS Single Sign-On.,Use AWS Cognito User Pools then enable access to unauthenticated identities.,,,,현재 모바일 게임을 개발 중인데 인증 서비스가 필요합니다. 소셜 미디어 로그인을 통해 인증된 사용자와 인증이 필요하지 않은 게스트 사용자에게 임시 AWS 자격 증명을 제공하는 AWS 서비스를 사용해야 합니다.AWS를 사용하여 이를 가장 잘 달성할 수 있는 방법은 무엇입니까?,Amazon Cognito 동기화를 사용하세요.,AWS Cognito 자격 증명 풀을 사용한 다음 인증되지 않은 자격 증명에 대한 액세스를 활성화합니다.,AWS Single Sign-On을 사용합니다.,AWS Cognito 사용자 풀을 사용한 다음 인증되지 않은 자격 증명에 대한 액세스를 활성화합니다.,,,0,,
udemy,DVA-02,161,"A company has an AWS account with only 2 Lambda functions, which process data and store the results in an S3 bucket. An Application Load Balancer is used to distribute the incoming traffic to the two Lambda functions as registered targets. You noticed that in peak times, the first Lambda function works with optimal performance but the second one is throttling the incoming requests. Which of the following is the MOST likely root cause of this issue?",C,C,The first function is using the unreserved account concurrency while the second function has been set with a concurrency execution limit of 1000.,The first function is using the unreserved account concurrency while the second function has been set with a concurrency execution limit of 800.,The concurrency execution limit provided to the first function is significantly higher than the second function.,The concurrency execution limit provided to the first function is less than the second function.,,,,회사에는 데이터를 처리하고 결과를 S3 버킷에 저장하는 2개의 Lambda 함수만 있는 AWS 계정이 있습니다. Application Load Balancer는 등록된 대상으로 두 개의 Lambda 함수에 수신 트래픽을 분산하는 데 사용됩니다. 피크 시간에는 첫 번째 Lambda 함수가 최적의 성능으로 작동하지만 두 번째 함수는 들어오는 요청을 제한하고 있음을 확인했습니다.다음 중 이 문제의 근본 원인일 가능성이 가장 높은 것은 무엇입니까?,"첫 번째 함수는 예약되지 않은 계정 동시성을 사용하는 반면, 두 번째 함수는 동시 실행 제한을 1000으로 설정했습니다.","첫 번째 함수는 예약되지 않은 계정 동시성을 사용하는 것이고, 두 번째 함수는 동시 실행 제한을 800으로 설정한 것입니다.",첫 번째 함수에 제공되는 동시 실행 제한은 두 번째 함수보다 훨씬 높습니다.,첫 번째 함수에 제공되는 동시 실행 제한은 두 번째 함수보다 작습니다.,,,0,,
udemy,DVA-02,162,You have just created a custom VPC with two public subnets and a custom route table. Which of the following is true with regards to route tables?,B,B,You cannot modify/edit the main route created by default by AWS.,A subnet can only be associated with one route table at a time.,A VPC has a default limit of 5 route tables.,You cannot associate multiple subnets to the same route table.,,,,두 개의 퍼블릭 서브넷과 하나의 사용자 지정 라우팅 테이블이 있는 사용자 지정 VPC를 생성했습니다. 다음 중 라우팅 테이블에 대한 설명으로 옳은 것은 무엇입니까?,AWS에서 기본적으로 생성한 기본 경로는 수정/편집할 수 없습니다.,서브넷은 한 번에 하나의 라우팅 테이블에만 연결할 수 있습니다.,VPC의 라우팅 테이블은 기본적으로 5개로 제한됩니다.,여러 서브넷을 동일한 라우팅 테이블에 연결할 수 없습니다.,,,0,,
